{
  "maTour": "T001",
  "tenHdv": "Phạm Thị Cúc",
  "tenTour": "Tour Hà Nội - Hạ Long",
  "moTa": "Tham quan Hà Nội và Vịnh Hạ Long 4 ngày 3 đêm",
  "ngayBatDau": "2025-10-01",
  "ngayKetThuc": "2025-10-04",
  "lichTrinh": "Ngày 1: Tham quan Hồ Gươm, Lăng Bác.\nNgày 2: Tham quan Hoàng Thành Thăng Long.\nNgày 3: Tham quan Vịnh Hạ Long.\nNgày 4: Tự do tham quan, mua sắm",
  "diaDiemRefs": ["Hồ Gươm", "Lăng Bác"," Hoàng Thành Thăng Long", "Vịnh Hạ Long"]
}